{
  "version": 2,
  "title": "The Wind in the Willows",
  "author": "Kenneth Grahame",
  "sha256": "d874ac24670373ea53c0a0d7a52601ca191e95d02270c7571bbd7ccf29cc6b1c",
  "chapters": 16,
  "level": "Chinese junior-high (CEFR A2-B1). Simple English meanings.",
  "language": "English",
  "glossary": {
    "whitewash": {
      "pos": "noun",
      "meaning": "A white liquid that people put on walls to make them white."
    },
    "penetrate": {
      "pos": "present participle",
      "meaning": "Going into or through something.",
      "forms": [
        "penetrating"
      ]
    },
    "lowly": {
      "pos": "adjective",
      "meaning": "Small and not grand or important."
    },
    "divine": {
      "pos": "adjective",
      "meaning": "Very special, as if it came from God."
    },
    "discontent": {
      "pos": "noun",
      "meaning": "A feeling of not being happy with what you have."
    },
    "bolt": {
      "pos": "past-tense verb",
      "meaning": "Ran away suddenly and very fast.",
      "forms": [
        "bolted"
      ]
    },
    "imperiously": {
      "pos": "adverb",
      "meaning": "In a proud way that expects people to do what is said."
    },
    "carriage": {
      "pos": "noun",
      "meaning": "An old kind of vehicle that horses pull, with seats for people."
    },
    "gravelled": {
      "pos": "adjective",
      "meaning": "Covered with small stones."
    },
    "residence": {
      "pos": "noun",
      "meaning": "A house where someone lives."
    },
    "scrabble": {
      "pos": "past-tense verb",
      "meaning": "Moved the hands or feet fast against something, to get through.",
      "forms": [
        "scrabbled"
      ]
    },
    "snout": {
      "pos": "noun",
      "meaning": "The long nose of an animal."
    },
    "caress": {
      "pos": "past-tense verb",
      "meaning": "Touched very softly and with love.",
      "forms": [
        "caressed"
      ]
    },
    "seclusion": {
      "pos": "noun",
      "meaning": "A state of being alone, away from other people."
    },
    "cellarage": {
      "pos": "noun",
      "meaning": "Rooms under a house, below the ground, where things are kept."
    },
    "carol": {
      "pos": "noun",
      "meaning": "A happy song. Here it is the song of birds."
    },
    "dulled": {
      "pos": "adjective",
      "meaning": "Made less sharp or less strong."
    },
    "pursue": {
      "pos": "past-tense verb",
      "meaning": "Went after something. 'Pursued his way' means he kept going on his way.",
      "forms": [
        "pursued"
      ]
    },
    "privilege": {
      "pos": "noun",
      "meaning": "A special right that only some people have."
    },
    "contemptuous": {
      "pos": "adjective",
      "meaning": "Showing that you think someone is not worth your respect."
    },
    "chaff": {
      "pos": "present participle",
      "meaning": "Joking with someone in a friendly way and laughing at them.",
      "forms": [
        "chaffing"
      ]
    },
    "jeeringly": {
      "pos": "adverb",
      "meaning": "In a rude way that makes fun of someone."
    },
    "thither": {
      "pos": "adverb",
      "meaning": "To that place; there."
    },
    "ramble": {
      "pos": "past-tense verb",
      "meaning": "Walked about for fun, with no fixed plan.",
      "forms": [
        "rambled"
      ]
    },
    "copse": {
      "pos": "noun",
      "meaning": "A small group of trees growing close together."
    },
    "conscience": {
      "pos": "noun",
      "meaning": "The feeling inside you that tells you what is right and wrong."
    },
    "meander": {
      "pos": "past-tense verb",
      "meaning": "Walked slowly, with no fixed way to go.",
      "forms": [
        "meandered"
      ]
    },
    "aimlessly": {
      "pos": "adverb",
      "meaning": "With no plan or purpose."
    },
    "sleek": {
      "pos": "adjective",
      "meaning": "Smooth and bright."
    },
    "sinuous": {
      "pos": "adjective",
      "meaning": "Having many smooth bends, one after the other."
    },
    "gurgle": {
      "pos": "noun",
      "meaning": "The low sound that water makes when it moves fast."
    },
    "bewitched": {
      "pos": "past participle",
      "meaning": "Under the power of magic."
    },
    "entranced": {
      "pos": "adjective",
      "meaning": "So full of wonder that you cannot think of anything else."
    },
    "spellbound": {
      "pos": "adjective",
      "meaning": "So interested that you cannot move or look away."
    },
    "insatiable": {
      "pos": "adjective",
      "meaning": "Never having enough; always wanting more."
    },
    "bijou": {
      "pos": "adjective",
      "meaning": "Small and pretty."
    },
    "glowworm": {
      "pos": "noun",
      "meaning": "A small insect with a body that gives out a soft light."
    },
    "pettishly": {
      "pos": "adverb",
      "meaning": "In a cross way, like a child who is angry."
    },
    "scull": {
      "pos": "noun",
      "meaning": "One of the light oars used to move a small boat."
    },
    "sculled": {
      "pos": "past-tense verb",
      "meaning": "Moved a small boat by pulling light oars through the water.",
      "forms": [
        "sculling"
      ]
    },
    "painter": {
      "pos": "noun",
      "meaning": "A rope at the front of a boat, used to hold it to the bank."
    },
    "gingerly": {
      "pos": "adverb",
      "meaning": "With great care, afraid that you might fall or be hurt."
    },
    "rapture": {
      "pos": "noun",
      "meaning": "A feeling of very great happiness."
    },
    "stern": {
      "pos": "noun",
      "meaning": "The back end of a boat."
    },
    "rowlock": {
      "pos": "noun",
      "meaning": "A part on the side of a boat where the oars rest."
    },
    "composedly": {
      "pos": "adverb",
      "meaning": "In a quiet way, in control of your feelings."
    },
    "wicker": {
      "pos": "noun",
      "meaning": "Thin sticks put together to make things such as chairs."
    },
    "ecstasy": {
      "pos": "noun",
      "meaning": "A feeling of very great happiness."
    },
    "forbear": {
      "pos": "past-tense verb",
      "meaning": "Stopped yourself from doing something.",
      "forms": [
        "forbore"
      ]
    },
    "forbearance": {
      "pos": "noun",
      "meaning": "Patient and quiet actions when you feel angry."
    },
    "excursion": {
      "pos": "noun",
      "meaning": "A short trip for fun."
    },
    "etiquette": {
      "pos": "noun",
      "meaning": "The rules for how to act in a polite way."
    },
    "allude": {
      "pos": "verb",
      "meaning": "To speak about something in a short way, without saying it clearly."
    },
    "weir": {
      "pos": "noun",
      "meaning": "A low wall across a river that holds back the water."
    },
    "moorhen": {
      "pos": "noun",
      "meaning": "A small dark bird that lives by the water."
    },
    "weasel": {
      "pos": "noun",
      "meaning": "A very small, thin animal with a long body that kills other small animals for food."
    },
    "stoat": {
      "pos": "noun",
      "meaning": "A small, thin animal with a long body and brown back; it kills other small animals."
    },
    "provender": {
      "pos": "noun",
      "meaning": "Food."
    },
    "impromptu": {
      "pos": "adjective",
      "meaning": "Done without a plan."
    },
    "forthwith": {
      "pos": "adverb",
      "meaning": "At once; right away."
    },
    "rumpus": {
      "pos": "noun",
      "meaning": "A lot of noise and trouble."
    },
    "togs": {
      "pos": "noun",
      "meaning": "Clothes. A friendly, everyday word."
    },
    "punt": {
      "pos": "verb",
      "meaning": "To move a flat boat along by pushing a long stick against the bottom of the river.",
      "forms": [
        "punting"
      ]
    },
    "stability": {
      "pos": "noun",
      "meaning": "The quality of not changing or moving easily."
    },
    "errant": {
      "pos": "adjective",
      "meaning": "Going from place to place, or going the wrong way."
    },
    "athwart": {
      "pos": "preposition",
      "meaning": "Across."
    },
    "swerve": {
      "pos": "past-tense verb",
      "meaning": "Turned suddenly to one side.",
      "forms": [
        "swerved"
      ]
    },
    "recollect": {
      "pos": "past-tense verb",
      "meaning": "Remembered.",
      "forms": [
        "recollected"
      ]
    },
    "forbid": {
      "pos": "past-tense verb",
      "meaning": "Did not allow.",
      "forms": [
        "forbade"
      ]
    },
    "prostrate": {
      "pos": "adjective",
      "meaning": "Lying flat."
    },
    "dejected": {
      "pos": "adjective",
      "meaning": "Sad and without hope."
    },
    "bedraggled": {
      "pos": "adjective",
      "meaning": "Wet and in a bad state, with clothes or hair out of place."
    },
    "emancipated": {
      "pos": "adjective",
      "meaning": "Set free."
    },
    "snigger": {
      "pos": "present participle",
      "meaning": "Laughing quietly in a rude way.",
      "forms": [
        "sniggering"
      ]
    },
    "ass": {
      "pos": "noun",
      "meaning": "An animal like a small horse. Here it means a silly person."
    },
    "compose": {
      "pos": "past participle",
      "meaning": "Made up a song or a piece of music.",
      "forms": [
        "composed"
      ]
    },
    "implore": {
      "pos": "past-tense verb",
      "meaning": "Asked in a very strong way, because of great need.",
      "forms": [
        "implored"
      ]
    },
    "ditty": {
      "pos": "noun",
      "meaning": "A short, simple song."
    },
    "dabble": {
      "pos": "present participle",
      "meaning": "Putting the beak or hands into water and moving about in it for fun.",
      "forms": [
        "dabbling"
      ]
    },
    "drake": {
      "pos": "noun",
      "meaning": "The male of the common water bird that people keep on farms.",
      "forms": [